UF,INSTITUICAO,MODALIDADE,NOME_POLO_OU_CAMPUS,MUNICIPIO_POLO,CURSO,URL_FONTE,URL_DOWNLOAD_PDF,URL_DOWNLOAD_PDF_LIMPA,STATUS_LINK,HASH_OU_ID_PDF_CANONICO,PPC_COMPARTILHADO,GRUPO_COMPARTILHAMENTO_ID,QTD_POLOS_NO_GRUPO,TIPO_VINCULO,ANO_PPC,LOCALIDADE_DOCUMENTO,NOME_ARQUIVO_LOCAL,CAMINHO_ARQUIVO_LOCAL,EVIDENCIA_MINIMA,OBS,ACAO_RECOMENDADA,DOC_ID
MA,UFMA,Educação a Distância,Polo Paraibano,Paraibano,Licenciatura em Matematica,https://snhm.com.br/anais/article/download/50/3/588,NAO_ENCONTRADO,,NAO_ENCONTRADO,,NAO,,,POLO_ESPECIFICO,NAO_ENCONTRADO,,,,"Artigo apresentado no XV Seminário Nacional de História da Matemática analisa PPCs de Licenciatura em Matemática do IFMA e informa, em quadro construído a partir de dados do e-MEC e páginas oficiais dos campi, que o Campus Zé Doca possui curso de Licenciatura em Matemática presencial, criado em 2010, em turno diurno, com 3.665 horas e duração de 8 semestres.[web:193] Postagens do IFMA Campus Zé Doca em redes sociais mencionam estudantes 'dos cursos de Licenciatura em Pedagogia, Licenciatura em Matemática, Tecnologia em Gestão de Turismo, ...', o que reforça a oferta da Licenciatura em Matemática no campus.[web:506]","O estudo sobre a História da Matemática em PPCs de Licenciatura em Matemática do IFMA afirma que foram identificados sete campi com cursos presenciais de Licenciatura em Matemática em funcionamento, incluindo Zé Doca, e que as informações foram extraídas das páginas oficiais dos campi e do e-MEC.[web:193] Em quadro específico, Zé Doca aparece com disciplinas 'História e Filosofia da Matemática' e 'História e Filosofia da Educação Matemática' na matriz curricular, o que indica a existência de um PPC estruturado; entretanto, o artigo não fornece o PPC em si nem link institucional para o documento.[web:193] Buscas no domínio ifma.edu.br e em repositórios de documentos não localizaram o PPC de Licenciatura em Matemática do Campus Zé Doca (ano e PDF), de modo que ano_ppc, url_download_pdf e status_link foram mantidos como NAO_ENCONTRADO.",VALIDACAO_MANUAL,
MA,UEMA,Educação Presencial,SÃO LUIS,São Luís,Licenciatura em Matematica,https://caminhosdosertao.uemasul.edu.br/vila-nova-dos-martirios/,https://caminhosdosertao.uemasul.edu.br/wp-content/uploads/2025/03/PPC-Matematica.pdf,https://caminhosdosertao.uemasul.edu.br/wp-content/uploads/2025/03/PPC-Matematica.pdf,OK_PDF,45FB0402A5F23BDBF679E6D10AF6AFD0C5098086E93A574C9AED42280594AF22,SIM,,4,INSTITUCIONAL_COMPARTILHADO,2024,POLOS_4__Vila_Nova_dos_Martirios_Amarante_do_Maranhao_Itinga_do_Maranhao_Porto_Franco,MA__Universidade_Estadual_da_Regiao_Tocantina_do_Maranhao_UEMASUL__PRESENCIAL__POLOS_4__Vila_Nova_dos_Martirios_Amarante_do_Maranhao_Itinga_do_Maranhao_Porto_Franco__2024__DOC0004.pdf,C:\Users\augus\Music\TCC\Data\new_date\pdfs_baixados\MA\MA__Universidade_Estadual_da_Regiao_Tocantina_do_Maranhao_UEMASUL__PRESENCIAL__POLOS_4__Vila_Nova_dos_Martirios_Amarante_do_Maranhao_Itinga_do_Maranhao_Porto_Franco__2024__DOC0004.pdf,"O 'Projeto Pedagógico do Curso de Matemática Licenciatura, do Programa de Formação Docente Caminhos do Sertão', datado de 2024, identifica-se como curso da UEMASUL vinculado ao CCENT e afirma, em sua apresentação, que o curso atende simultaneamente às Unidades Avançadas de Amarante, Itinga do Maranhão, Porto Franco e Vila Nova dos Martírios, localizadas na área de abrangência da universidade.[web:29] A página oficial da Unidade Avançada de Vila Nova dos Martírios indica o endereço 'Escola Municipal José de Ribamar Fiquene – Av. Rio Branco, S/N – Centro', identificando o local de funcionamento da unidade.[web:432][web:329]","Notícias do site do programa destacam atividades acadêmicas realizadas especificamente pelos alunos do curso de Matemática na Unidade Avançada de Vila Nova dos Martírios, como participação em jornadas científicas e aulas práticas, referindo-se a esses estudantes como 'alunos do curso de Matemática do Programa de Formação de Professores Caminhos do Sertão'.[web:434][web:331] Como o PPC de 2024 explicita que é o projeto pedagógico comum para o curso de Matemática Licenciatura oferecido nas quatro Unidades Avançadas do programa, ele é marcado como PPC compartilhado entre Amarante, Itinga do Maranhão, Porto Franco e Vila Nova dos Martírios.[web:29][web:329]",OK,DOC0004
MA,IFMA,Educação Presencial,CAMPUS CODÓ,Codó,Licenciatura em Matematica,https://www.uema.br/2018/03/programa-ensinar-encerra-primeiro-semestre-letivo-com-resultados-positivos/,NAO_ENCONTRADO,,NAO_ENCONTRADO,,NAO,,,POLO_ESPECIFICO,NAO_ENCONTRADO,,,,"Notícia oficial da UEMA sobre o primeiro semestre do Programa Ensinar indica que, em 2017, o programa ofereceu cursos de Ciências Biológicas, Matemática, História, Geografia, Letras e Pedagogia licenciatura em 12 polos, incluindo Coelho Neto como um dos polos atendidos.[web:452] Editais de matrícula geral do Programa Ensinar listam o 'Polo Coelho Neto' com endereço 'Av. Antonio Guimarães, s/n.º, Bairro Olho D’aguinha, CEP 65620-000, Coelho Neto – MA', confirmando-o como polo de ensino superior vinculado ao programa.[web:469][web:465]","Embora os documentos do Programa Ensinar confirmem a existência do polo Coelho Neto e listem Matemática Licenciatura entre os cursos ofertados pelo programa de forma geral, eles não apresentam tabela que associe explicitamente o curso de Matemática Licenciatura ao polo Coelho Neto, nem disponibilizam o PPC do curso de Matemática usado no programa.[web:452][web:469][web:458] Não foi localizado PPC de Matemática Licenciatura específico para o Polo Coelho Neto (nem um PPC geral de Matemática do Ensinar) em repositórios públicos da UEMA ou PROG, de modo que ano_ppc, url_download_pdf e status_link foram mantidos como NAO_ENCONTRADO.",VALIDACAO_MANUAL,
MA,UEMA,Educação Presencial,Bacabal - CESBA,Bacabal,Licenciatura em Matematica,http://www.ufma.br/portalUFMA/arquivo/Gpm4exdlwmLT3Bw.pdf,http://www.ufma.br/portalUFMA/arquivo/Gpm4exdlwmLT3Bw.pdf,http://www.ufma.br/portalUFMA/arquivo/Gpm4exdlwmLT3Bw.pdf,OK_PDF,082EDBCD6418A7265401EA110DDD0AB2F7D8C164C8AABC367401A4830DB1295E,SIM,,7,INSTITUCIONAL_COMPARTILHADO,2013,POLOS_21__Humberto_de_Campos_Imperatriz_Penalva_Bom_Jesus_das_Selvas_Candido_Mendes_Paraibano_Grajau,MA__Universidade_Federal_do_Maranhao_UFMA__EAD__POLOS_21__Humberto_de_Campos_Imperatriz_Penalva_Bom_Jesus_das_Selvas_Candido_Mendes_Paraibano_Grajau__2013__DOC0001.pdf,C:\Users\augus\Music\TCC\Data\new_date\pdfs_baixados\MA\MA__Universidade_Federal_do_Maranhao_UFMA__EAD__POLOS_21__Humberto_de_Campos_Imperatriz_Penalva_Bom_Jesus_das_Selvas_Candido_Mendes_Paraibano_Grajau__2013__DOC0001.pdf,"O PPC oficial 'PROJETO PEDAGÓGICO DO CURSO DE LICENCIATURA EM MATEMÁTICA NA MODALIDADE DE EDUCAÇÃO A DISTÂNCIA' identifica o curso de graduação em Matemática (licenciatura, modalidade a distância), datado de 2013, como projeto pedagógico institucional da licenciatura EAD da UFMA.[web:5] O documento de 'Matrículas homologadas' da DTED/UFMA para ingresso 2021-1 lista diversas entradas de 'MATEMÁTICA/DTED - EAD' por polo, incluindo explicitamente 'POLO: VIANA-MA – ANO-PERÍODO INGRESSO: 2021-1 – MATEMÁTICA/DTED - EAD', além de Alto Parnaíba, Cândido Mendes, Grajaú, Loreto, Paraibano e Penalva, evidenciando que o mesmo curso de Licenciatura em Matemática EAD funciona em todos esses polos.[web:40]","O PPC de 2013 é o único projeto pedagógico institucional encontrado para a Licenciatura em Matemática EAD da UFMA e não é organizado por polo específico, mas por curso, indicando que o mesmo documento fundamenta a oferta em diferentes polos UAB.[web:5] O ato de matrículas homologadas comprova a existência do curso MATEMÁTICA/DTED - EAD no Polo UAB Viana em 2021-1, sugerindo continuidade do uso do PPC institucional, embora não tenha sido localizada versão atualizada em domínio público, razão pela qual se recomenda confirmação interna da vigência.[web:40]",OK,DOC0001
MA,UFMA,Educação a Distância,Polo Alto Parnaíba,Alto Parnaíba,Licenciatura em Matematica,https://portalpadrao.ufma.br/site/noticias/realizacao-de-um-sonho-sted-concede-outorga-de-grau-aos-estudantes-dos-cursos-de-graduacao-a-distancia-da-ufma,http://www.ufma.br/portalUFMA/arquivo/Gpm4exdlwmLT3Bw.pdf,http://www.ufma.br/portalUFMA/arquivo/Gpm4exdlwmLT3Bw.pdf,OK_PDF,082EDBCD6418A7265401EA110DDD0AB2F7D8C164C8AABC367401A4830DB1295E,SIM,,17,INSTITUCIONAL_COMPARTILHADO,2013,POLOS_21__Humberto_de_Campos_Imperatriz_Penalva_Bom_Jesus_das_Selvas_Candido_Mendes_Paraibano_Grajau,MA__Universidade_Federal_do_Maranhao_UFMA__EAD__POLOS_21__Humberto_de_Campos_Imperatriz_Penalva_Bom_Jesus_das_Selvas_Candido_Mendes_Paraibano_Grajau__2013__DOC0001.pdf,C:\Users\augus\Music\TCC\Data\new_date\pdfs_baixados\MA\MA__Universidade_Federal_do_Maranhao_UFMA__EAD__POLOS_21__Humberto_de_Campos_Imperatriz_Penalva_Bom_Jesus_das_Selvas_Candido_Mendes_Paraibano_Grajau__2013__DOC0001.pdf,"Notícia oficial da UFMA sobre colação de grau dos cursos de graduação a distância informa que 82 formandos de Matemática, Letras/Português e Administração são oriundos, entre outros, dos polos de Açailândia, Alto Parnaíba, Arari, Barra do Corda, Cândido Mendes, Centro Novo, Cururupu, Dom Pedro, Grajaú, Loreto, Nina Rodrigues, Paraibano, Pastos Bons, Penalva, São Luís, Urbano Santos e Viana, listando Açailândia como polo com formandos em Matemática EaD.[web:39] O PPC institucional da Licenciatura em Matemática na modalidade de Educação a Distância da UFMA é o documento 'PROJETO PEDAGÓGICO DO CURSO DE LICENCIATURA EM MATEMÁTICA NA MODALIDADE DE EDUCAÇÃO A DISTÂNCIA', São Luís – MA, 2013.[web:65]","Vídeo de trabalho acadêmico identifica 'Curso: Licenciatura em Matemática turma 01 – Polo: Açailândia-MA', evidenciando turma de Matemática vinculada a polo em Açailândia.[web:451] Considerando que a UFMA descreve um único PPC para a Licenciatura em Matemática EaD e que a mesma licenciatura é ofertada em múltiplos polos UAB, incluindo Açailândia, o PPC de 2013 é associado ao Polo UAB Açailândia com ppc_compartilhado=SIM e polos_relacionados correspondentes aos polos explicitamente citados pela UFMA como tendo formandos em Matemática EaD.[web:39][web:65]",OK,DOC0001
MA,UEMA,Educação Presencial,Instituto Educacional Prof Olga Portela,Brejo,Licenciatura em Matematica,http://www.ufma.br/portalUFMA/arquivo/RnpkhNnOfSdPfri.pdf,http://www.ufma.br/portalUFMA/arquivo/Gpm4exdlwmLT3Bw.pdf,http://www.ufma.br/portalUFMA/arquivo/Gpm4exdlwmLT3Bw.pdf,OK_PDF,082EDBCD6418A7265401EA110DDD0AB2F7D8C164C8AABC367401A4830DB1295E,SIM,,9,INSTITUCIONAL_COMPARTILHADO,2013,POLOS_21__Humberto_de_Campos_Imperatriz_Penalva_Bom_Jesus_das_Selvas_Candido_Mendes_Paraibano_Grajau,MA__Universidade_Federal_do_Maranhao_UFMA__EAD__POLOS_21__Humberto_de_Campos_Imperatriz_Penalva_Bom_Jesus_das_Selvas_Candido_Mendes_Paraibano_Grajau__2013__DOC0001.pdf,C:\Users\augus\Music\TCC\Data\new_date\pdfs_baixados\MA\MA__Universidade_Federal_do_Maranhao_UFMA__EAD__POLOS_21__Humberto_de_Campos_Imperatriz_Penalva_Bom_Jesus_das_Selvas_Candido_Mendes_Paraibano_Grajau__2013__DOC0001.pdf,"O Relatório RAP (Relatório de Alunos por Polo) da DTED/UFMA contém seção com o cabeçalho 'Pólo: URBANO SANTOS-MA – Ano-Período Ingresso: 2021-1 – MATEMÁTICA/DTED - EAD', seguido de linhas com 'Matrícula', 'Discente', 'CPF' e 'Data de Nascimento', comprovando a existência de turma de Licenciatura em Matemática EAD no Polo Urbano Santos.[web:305] O PPC de 2013 da Licenciatura em Matemática na modalidade de Educação a Distância é o projeto pedagógico institucional do curso de Matemática EAD da UFMA.[web:65]","Os documentos de matrículas homologadas e de eleições de líderes de turma mostram que o curso 'MATEMÁTICA/DTED – EAD' é ofertado, pelo menos, nos polos Alto Parnaíba, Cândido Mendes, Grajaú, Loreto, Paraibano, Penalva, Viana e Santa Quitéria, além de outras localidades listadas em estudos sobre o curso de Matemática EAD.[web:40][web:74][web:7] Como o PPC identificado é único e não há variação por polo, ele foi associado ao Polo Urbano Santos com ppc_compartilhado=SIM e polos_relacionados representando o conjunto de polos em que o curso de Matemática/DTED – EAD está evidenciado.",OK,DOC0001
MA,UEMASUL,Educação Presencial,Campus SEDE,Imperatriz,Licenciatura em Matematica,https://www.prog.uema.br/wp-content/uploads/2015/03/PPC-MATEMATICA-BACABAL.protected.pdf,https://www.prog.uema.br/wp-content/uploads/2015/03/PPC-MATEMATICA-BACABAL.protected.pdf,https://www.prog.uema.br/wp-content/uploads/2015/03/PPC-MATEMATICA-BACABAL.protected.pdf,OK_PDF,6DE57A36E2A3C87DFFBA9615D41E9A6AA7797F3FB4E4D399D268DB8966D60B34,NAO,,,POLO_ESPECIFICO,2015,POLO__Campus_Bacabal__Bacabal,MA__Universidade_Estadual_do_Maranhao_UEMA__PRESENCIAL__POLO__Campus_Bacabal__Bacabal__2015__DOC0005.pdf,C:\Users\augus\Music\TCC\Data\new_date\pdfs_baixados\MA\MA__Universidade_Estadual_do_Maranhao_UEMA__PRESENCIAL__POLO__Campus_Bacabal__Bacabal__2015__DOC0005.pdf,"O documento 'PROJETO PEDAGÓGICO' do 'CURSO MATEMÁTICA LICENCIATURA' identifica-se na capa e na folha de rosto como projeto do Campus Bacabal da UEMA, com o local 'Bacabal' e o ano '2015', configurando o PPC específico da Licenciatura em Matemática do Campus Bacabal.[web:174]","Na identificação do curso, o PPC registra 'DENOMINAÇÃO DO CURSO: MATEMÁTICA LICENCIATURA', 'TITULAÇÃO CONFERIDA: LICENCIADO EM MATEMÁTICA', 'CAMPUS: Campus Bacabal', 'REGIME LETIVO: Semestral', 'TURNO(S) DE OFERTA: Matutino ou Vespertino ou Noturno', 'VAGAS AUTORIZADAS: 30 vagas por semestre letivo' e 'CARGA HORÁRIA DO CURSO: 3.015h', evidenciando ser o PPC oficial da Licenciatura em Matemática do Campus Bacabal.[web:174] O texto do projeto é fortemente contextualizado no município de Bacabal e faz referência exclusiva ao 'Campus Bacabal da Universidade Estadual do Maranhão', sem menção a utilização do mesmo PPC em outros campi; por isso, ppc_compartilhado foi marcado como NAO.",OK,DOC0005
MA,UEMASUL,Educação Presencial,Unidade Acadêmica Darcy Ribeiro,Porto Franco,Licenciatura em Matematica,NAO_ENCONTRADO,NAO_ENCONTRADO,,NAO_ENCONTRADO,,NAO,,,POLO_ESPECIFICO,NAO_ENCONTRADO,,,,"Documentos institucionais da UEMA listam o Centro de Estudos Superiores de Zé Doca (CESZD) e seus cursos, mas não disponibilizam publicamente PPC específico de Licenciatura em Matemática para esse centro; em material de expansão institucional, Zé Doca aparece associado principalmente a cursos de Letras e Ciências (Biologia), sem referência explícita a um PPC de Matemática acessível ao público.[web:52][web:88]","Não foi localizado, em portais oficiais públicos da UEMA (PDI, anuários, páginas de campi, repositório de PPCs), um arquivo de PPC de Licenciatura em Matemática vinculado ao CESZD. Dada a ausência de link direto e de referência explícita a um PPC de Matemática para Zé Doca em fontes abertas, os metadados do PPC foram mantidos como NAO_ENCONTRADO para evitar inferências sobre ano, vigência ou compartilhamento com outros centros/polos.[web:52][web:88]",VALIDACAO_MANUAL,
MA,UFMA,Educação a Distância,POLO GRAJAU UAB,Grajaú,Licenciatura em Matematica,NAO_ENCONTRADO,NAO_ENCONTRADO,,NAO_ENCONTRADO,,NAO,,,POLO_ESPECIFICO,NAO_ENCONTRADO,,,,"Perfis institucionais de comunicação do IFMA Campus Açailândia divulgam o curso de Licenciatura em Matemática presencial, apresentando-o como curso superior do campus, mas não disponibilizam o Projeto Pedagógico do Curso (PPC) em link público oficial.[web:277][web:266][web:278]","Publicações em perfis identificados como oficiais do IFMA Campus Açailândia e da coordenação do curso apresentam o 'curso de Licenciatura em Matemática' como oferta de graduação do campus, inclusive em chamadas para o SISU 2026.[web:277][web:266][web:278] Entretanto, buscas em domínio ifma.edu.br e repositórios de documentos institucionais não retornaram um PPC de Licenciatura em Matemática específico do Campus Açailândia com acesso público; por isso, ano_ppc, URLs e status do PPC foram mantidos como NAO_ENCONTRADO.",VALIDACAO_MANUAL,
MA,UFMA,Educação a Distância,PÓLO DE ARARI,Arari,Licenciatura em Matematica,NAO_ENCONTRADO,NAO_ENCONTRADO,,NAO_ENCONTRADO,,NAO,,,POLO_ESPECIFICO,NAO_ENCONTRADO,,,,"A página oficial 'Polos e Centros' do Programa Ensinar/UEMA lista o polo Vitória do Mearim com endereço 'Escola Municipal Maria Celeste Barros. Rua 23 de outubro, Bairro Manijituba. CEP 65350-000 Vitória do Mearim- MA', confirmando o local de funcionamento do polo.[web:84] A cartilha oficial do Programa Ensinar registra que o curso de Matemática Licenciatura é ofertado em diversos polos, e sua tabela de resumo de carga horária traz linha específica 'Vitória do Mearim - Polo' sob o curso de Matemática Licenciatura, evidenciando que há turma de Matemática Licenciatura nesse polo.[web:300]","Matéria oficial da UEMA relata outorga de grau para concludentes do Programa Ensinar no Polo Vitória do Mearim, indicando a atuação do programa na formação de professores no município.[web:290] A cartilha 'PROGRAMA ENSINAR – FORMAÇÃO DE PROFESSORES DA UEMA' apresenta quadro de 'Resumo da carga horária da Estrutura Curricular do Curso de Matemática Licenciatura', em que, na coluna de distribuição por polos, aparecem entradas como 'Viana - Polo' e 'Vitória do Mearim - Polo', com cargas horárias indicadas, sob a rubrica 'Fonte: anuário UEMA' e 'Fonte: PPC dos cursos', mostrando que o curso de Matemática Licenciatura é ofertado no polo Vitória do Mearim.[web:300] Contudo, não foi localizado um PPC específico de Matemática Licenciatura para o Polo Vitória do Mearim (ou para o Programa Ensinar como um todo) em repositório público da UEMA; assim, ano_ppc, URL e status do PPC foram mantidos como NAO_ENCONTRADO.",VALIDACAO_MANUAL,
MA,UEMA,Educação Presencial,Polo UAB - ARARI,Arari,Licenciatura em Matematica,NAO_ENCONTRADO,NAO_ENCONTRADO,,NAO_ENCONTRADO,,NAO,,,POLO_ESPECIFICO,NAO_ENCONTRADO,,,,"Embora haja produções acadêmicas que analisam componentes curriculares e o uso de pensamento computacional e outros temas em cursos de Licenciatura em Matemática do IFMA (incluindo menções ao campus Buriticupu), o PPC oficial do curso de Licenciatura em Matemática presencial do IFMA – Campus Buriticupu não foi encontrado em repositório institucional público verificável.[web:28]","Buscas em portais públicos do IFMA e em bases acadêmicas retornaram apenas referências indiretas (artigos, relatórios, análises de matriz curricular) ao curso de Licenciatura em Matemática do Campus Buriticupu, sem disponibilizar o arquivo institucional do PPC (com ano e resolução de aprovação). Para evitar inferência sobre ano ou compartilhamento com outros campi com base apenas em estudos secundários, todos os metadados específicos do PPC foram marcados como NAO_ENCONTRADO.[web:28]",VALIDACAO_MANUAL,
MA,IFMA,Educação a Distância,Polo UAB - SAO JOAO DOS PATOS,São João dos Patos,Licenciatura em Matematica,NAO_ENCONTRADO,NAO_ENCONTRADO,,NAO_ENCONTRADO,,NAO,,,POLO_ESPECIFICO,NAO_ENCONTRADO,,,,"Produções institucionais da UFMA indicam a existência de um Projeto Político Pedagógico do Curso de Licenciatura em Matemática presencial no Campus São Luís (Cidade Universitária), mas o documento do PPC não é disponibilizado em canal público com link direto, impossibilitando identificar ano, URL ou status do arquivo.[web:157][web:154]","E-book da EDUFMA sobre ensino de ciências e matemática relata uma pesquisa que 'apresenta resultados da análise do Projeto Pedagógico do Curso (PPC), intitulado Projeto Político Pedagógico do Curso de Licenciatura em Matemática da Universidade Federal do Maranhão', o que comprova a existência de um PPC formal da Licenciatura em Matemática da UFMA.[web:157] A página do Programa de Pós-Graduação em Ensino de Ciências e Matemática (PPECEM/UFMA) lista dissertações que analisam o curso presencial de Licenciatura em Matemática da UFMA campus São Luís, referindo-se à organização curricular do curso e ao seu projeto pedagógico, sem, no entanto, disponibilizar o PPC como arquivo público.[web:154] Como nenhum PDF ou página oficial com o PPC da licenciatura presencial foi encontrado, ano_ppc, URL e status do link foram mantidos como NAO_ENCONTRADO.",VALIDACAO_MANUAL,
MA,UNIVIMA,Educação Presencial,CAMPUS  - SÃO LUÍS - PRAIA GRANDE,São Luís,Licenciatura em Matematica,https://caminhosdosertao.uemasul.edu.br/wp-content/uploads/2025/03/PPC-Matematica.pdf,https://caminhosdosertao.uemasul.edu.br/wp-content/uploads/2025/03/PPC-Matematica.pdf,https://caminhosdosertao.uemasul.edu.br/wp-content/uploads/2025/03/PPC-Matematica.pdf,OK_PDF,45FB0402A5F23BDBF679E6D10AF6AFD0C5098086E93A574C9AED42280594AF22,SIM,,4,INSTITUCIONAL_COMPARTILHADO,2024,POLOS_4__Vila_Nova_dos_Martirios_Amarante_do_Maranhao_Itinga_do_Maranhao_Porto_Franco,MA__Universidade_Estadual_da_Regiao_Tocantina_do_Maranhao_UEMASUL__PRESENCIAL__POLOS_4__Vila_Nova_dos_Martirios_Amarante_do_Maranhao_Itinga_do_Maranhao_Porto_Franco__2024__DOC0004.pdf,C:\Users\augus\Music\TCC\Data\new_date\pdfs_baixados\MA\MA__Universidade_Estadual_da_Regiao_Tocantina_do_Maranhao_UEMASUL__PRESENCIAL__POLOS_4__Vila_Nova_dos_Martirios_Amarante_do_Maranhao_Itinga_do_Maranhao_Porto_Franco__2024__DOC0004.pdf,"O documento 'PROJETO PEDAGÓGICO DO CURSO DE MATEMÁTICA LICENCIATURA' da UEMASUL, datado de 2024, identifica-se como 'Projeto Pedagógico do Curso de Matemática Licenciatura, da Universidade Estadual da Região Tocantina do Maranhão - UEMASUL, vinculado ao Centro de Ciências Exatas, Naturais e Tecnológicas - CCENT', com local 'Imperatriz/MA 2024', constituindo o PPC institucional do curso.[web:29] Na apresentação, o texto explicita que o curso de Matemática Licenciatura do Programa de Formação Docente Caminhos do Sertão será ofertado 'nos municípios de Amarante do Maranhão, Itinga do Maranhão, Porto Franco e Vila Nova dos Martírios', indicando que o mesmo PPC atende aos quatro polos/unidades avançadas.[web:29][web:195]","O PPC de 2024 descreve, na identificação do curso, 'DENOMINAÇÃO DO CURSO: Projeto Pedagógico do Curso de Matemática Licenciatura; ÁREA: Ciências Exatas; PERÍODO MÍNIMO DE INTEGRALIZAÇÃO: 8; REGIME LETIVO: Semestral; TURNO (S) DE OFERTA: Diurno', caracterizando o curso de Matemática Licenciatura da UEMASUL no âmbito do CCENT.[web:29] Na seção de contextualização, o documento afirma que 'a oferta do Curso Superior de Licenciatura em Matemática do Programa de Formação Docente Caminhos do Sertão será nos municípios de Amarante do Maranhão, Itinga do Maranhão, Porto Franco e Vila Nova dos Martírios', explicitando o uso compartilhado de um único PPC para essas quatro Unidades Avançadas.[web:29][web:195] Por isso, foi atribuído ano_ppc=2024 (data indicada no PPC) e ppc_compartilhado=SIM, listando como polos_relacionados os quatro municípios atendidos.",OK,DOC0004
MA,UFMA,Educação a Distância,Polo Cururupu,Cururupu,Licenciatura em Matematica,https://caminhosdosertao.uemasul.edu.br/wp-content/uploads/2025/03/PPC-Matematica.pdf,https://caminhosdosertao.uemasul.edu.br/wp-content/uploads/2025/03/PPC-Matematica.pdf,https://caminhosdosertao.uemasul.edu.br/wp-content/uploads/2025/03/PPC-Matematica.pdf,OK_PDF,45FB0402A5F23BDBF679E6D10AF6AFD0C5098086E93A574C9AED42280594AF22,SIM,,4,INSTITUCIONAL_COMPARTILHADO,2024,POLOS_4__Vila_Nova_dos_Martirios_Amarante_do_Maranhao_Itinga_do_Maranhao_Porto_Franco,MA__Universidade_Estadual_da_Regiao_Tocantina_do_Maranhao_UEMASUL__PRESENCIAL__POLOS_4__Vila_Nova_dos_Martirios_Amarante_do_Maranhao_Itinga_do_Maranhao_Porto_Franco__2024__DOC0004.pdf,C:\Users\augus\Music\TCC\Data\new_date\pdfs_baixados\MA\MA__Universidade_Estadual_da_Regiao_Tocantina_do_Maranhao_UEMASUL__PRESENCIAL__POLOS_4__Vila_Nova_dos_Martirios_Amarante_do_Maranhao_Itinga_do_Maranhao_Porto_Franco__2024__DOC0004.pdf,"O 'PROJETO PEDAGÓGICO DO CURSO DE MATEMÁTICA LICENCIATURA', vinculado ao CCENT/UEMASUL, identifica-se como PPC do curso de Matemática Licenciatura da UEMASUL, com local 'Imperatriz/MA 2024', estabelecendo o ano do PPC.[web:29] Na contextualização, o documento afirma que 'a oferta do Curso Superior de Licenciatura em Matemática do Programa de Formação Docente Caminhos do Sertão será nos municípios de Amarante do Maranhão, Itinga do Maranhão, Porto Franco e Vila Nova dos Martírios', o que indica uso compartilhado do mesmo PPC para as quatro unidades.[web:29][web:195]","O PPC descreve o curso de Matemática Licenciatura como pertencente ao Centro de Ciências Exatas, Naturais e Tecnológicas (CCENT) da UEMASUL, com regime semestral e carga horária total definidos, e explicita que se trata do Projeto Pedagógico do Curso de Matemática Licenciatura da UEMASUL.[web:29] A versão cadastrada no SIGAA/UEMASUL reitera que o PPC do Programa de Formação Docente Caminhos do Sertão abrange as Unidades Avançadas/Unidades Acadêmicas de Amarante do Maranhão, Itinga do Maranhão, Porto Franco e Vila Nova dos Martírios; por isso, foi atribuído ppc_compartilhado=SIM, com polos_relacionados contendo os quatro municípios.[web:195]",OK,DOC0004
