UF,INSTITUICAO,MODALIDADE,NOME_POLO_OU_CAMPUS,MUNICIPIO_POLO,CURSO,URL_FONTE,URL_DOWNLOAD_PDF,URL_DOWNLOAD_PDF_LIMPA,STATUS_LINK,HASH_OU_ID_PDF_CANONICO,PPC_COMPARTILHADO,GRUPO_COMPARTILHAMENTO_ID,QTD_POLOS_NO_GRUPO,TIPO_VINCULO,ANO_PPC,LOCALIDADE_DOCUMENTO,NOME_ARQUIVO_LOCAL,CAMINHO_ARQUIVO_LOCAL,EVIDENCIA_MINIMA,OBS,ACAO_RECOMENDADA,DOC_ID
BA,UESC,Educação a Distância,Polo UAB - IBICUI,Ibicuí,Licenciatura em Matematica,https://ufrb.edu.br/cetec/images/documentos/Diversos/PPC_LMatEaD.pdf,https://ufrb.edu.br/cetec/images/documentos/Diversos/PPC_LMatEaD.pdf,https://ufrb.edu.br/cetec/images/documentos/Diversos/PPC_LMatEaD.pdf,OK_PDF,40F4848128BE5761076E3842132F510C17066B93408DEE582A011E7A86FC7A81,SIM,,3,POLO_ESPECIFICO,NAO_ENCONTRADO,POLOS_9__Cruz_das_Almas_Teixeira_de_Freitas_Capim_Grosso_Vitoria_da_Conquista_Rio_Real_Ilheus_Ipira_,BA__UFRB__EAD__POLOS_3__Macaubas_Vitoria_da_Conquista_Ipira__2019__DOC0007.pdf,C:\Users\augus\Music\TCC\Data\new_date\pdfs_baixados\BA\BA__UFRB__EAD__POLOS_3__Macaubas_Vitoria_da_Conquista_Ipira__2019__DOC0007.pdf,"Fontes oficiais da UESC/NEAD e divulgação do Edital 219/2023 confirmam a existência do curso de Licenciatura em Matemática EaD e a oferta de vagas para o polo Ibicuí, mas não fornecem acesso ao Projeto Pedagógico do Curso em PDF.[web:164][web:168][web:173]","O resumo do Edital 219/2023 mostra que a Licenciatura em Matemática EaD da UESC oferece 45 vagas no polo Ibicuí,[web:173] comprovando a atuação do curso nesse polo. A página do curso no NEAD/UESC, entretanto, apenas descreve o objetivo geral e a estrutura básica do curso EaD de Matemática e indica a existência de um 'Projeto Pedagógico do Curso', sem disponibilizar o documento de PPC em PDF na navegação recuperável pela busca.[web:164] Nem a área institucional do NEAD nem os documentos públicos identificados (como resoluções ou relatórios) apresentam o PPC de Matemática EaD; portanto, o PPC não foi encontrado em fonte oficial pública.",OK,DOC0007
BA,UFBA,Educação a Distância,Ilheus - Malhado,Ilhéus,Licenciatura em Matematica,https://unead.uneb.br/index.php/matematica/,NAO_ENCONTRADO,,NAO_ENCONTRADO,,NAO,,1,POLO_ESPECIFICO,NAO_ENCONTRADO,,,,"A UFBA divulga a Licenciatura em Matemática EaD em páginas da SEAD com matriz curricular e dados de oferta, e editais de chamamento público definem polos de apoio para os cursos de Licenciatura EaD, mas nenhum desses documentos fornece o Projeto Pedagógico do Curso em PDF nem o vincula ao polo Ilhéus - Malhado.[web:182][web:185][web:183][web:177]","A 3ª, 4ª, 5ª e 6ª ofertas da Licenciatura em Matemática EaD têm páginas específicas na SEAD/UFBA com histórico, disciplinas e carga horária, indicando a organização curricular do curso.[web:182][web:185][web:188][web:191] O Edital de Chamamento Público aos municípios para cursos de Licenciatura EaD cita a Licenciatura em Matemática e define critérios para municípios sede de polos, sem anexar PPC.[web:183] O relatório INEP sobre a Matemática EaD da UFBA destaca que o PPC foi analisado e considerado adequado,[web:177] o que confirma sua existência interna. Entretanto, não foi localizado em ufba.br um arquivo de PPC de Matemática EaD público; logo, também para o polo Ilhéus - Malhado o PPC não pôde ser identificado em fonte oficial.",NOVA_BUSCA,
BA,IFBA,Educação a Distância,Polo UAB de Dias D' Ávila,Dias d´Ávila,Licenciatura em Matematica,https://dcet.alagoinhas.uneb.br/matematica/,https://portal.ifba.edu.br/ead/uab/cursos/licenciaturas/matematica/documentos/ppc-2023-licmatead_merged-final.pdf,https://portal.ifba.edu.br/ead/uab/cursos/licenciaturas/matematica/documentos/ppc-2023-licmatead_merged-final.pdf,OK_PDF,EE12BA1E3E451CFB965340844A3894927AC0FC0EA750021A3B1E7C5CB33A7690,NAO,,1,POLO_ESPECIFICO,2023,POLOS_4__Itabuna_Brumado_Eunapolis_Dias_d_Avila,BA__Instituto_Federal_de_Educacao_Ciencia_e_Tecnologia_da_Bahia_IFBA__EAD__POLOS_6__Paulo_Afonso_Dias_d_Avila_Euclides_da_Cunha_Irece_Seabra_Salvador__2023__DOC0006.pdf,C:\Users\augus\Music\TCC\Data\new_date\pdfs_baixados\BA\BA__Instituto_Federal_de_Educacao_Ciencia_e_Tecnologia_da_Bahia_IFBA__EAD__POLOS_6__Paulo_Afonso_Dias_d_Avila_Euclides_da_Cunha_Irece_Seabra_Salvador__2023__DOC0006.pdf,"A ficha técnica e a seção 'Documentos do Curso' da página oficial da Licenciatura em Matemática EaD do IFBA indicam um único PPC (PDF) associado ao curso, sem distinções por polo, o que evidencia que o documento é compartilhado entre todos os polos do programa UAB.","O texto institucional do DCET – Campus II – Alagoinhas apresenta a Licenciatura em Matemática, seus objetivos de formação e a infraestrutura disponível para o curso.[web:256] Um estudo da SBEM sobre os cursos de Licenciatura em Matemática da UNEB indica que cada campus (incluindo Campus II – Alagoinhas) possui estrutura curricular própria, com matriz, ementário, fluxograma e Projeto Pedagógico do Curso,[web:252] mas esses PPCs não são disponibilizados publicamente em domínio uneb.br para o campus Alagoinhas. Na ausência de um arquivo explícito de PPC ou link direto para tal documento, o PPC permanece não localizado.",NOVA_BUSCA,DOC0006
BA,UNEB,Educação a Distância,UNEAD,Brumado,Licenciatura em Matemática,https://portal.ifba.edu.br/ead/uab/cursos/licenciaturas/matematica/lic-matematica,,,NAO_ENCONTRADO,,SIM,,2,INSTITUCIONAL_COMPARTILHADO,2023,POLOS_7__Sao_Francisco_do_Conde_Paulo_Afonso_Irece_Lauro_de_Freitas_Seabra_Salvador_Euclides_da_Cunh,,,"O arquivo PPC_Lic._Matematica_EaD_1.pdf, em domínio oficial do IFBA, é identificado na resolução como Projeto Pedagógico do Curso Superior de Licenciatura em Matemática na modalidade Educação a Distância do campus Salvador, que é a sede do curso EaD para os polos UAB.[web:16] | EXCLUIDO_MANUAL_NAO_PPC_BA_DOC0001","O curso de Licenciatura em Matemática EaD do IFBA, com sede no campus Salvador, tem seu Projeto Pedagógico formalizado no documento PPC_Lic._Matematica_EaD_1.pdf.[web:16] A página institucional do curso EaD confirma a existência e descrição do curso de Licenciatura em Matemática na modalidade a distância.[web:15] Este mesmo PPC é utilizado para os diferentes polos UAB atendidos pelo curso, incluindo Salvador IAT e Euclides da Cunha; o ano exato do PPC não é identificável no trecho acessível e demanda leitura integral do PDF.[web:15][web:16] | Excluido manualmente: BA DOC0001 nao e PPC valido.",VALIDACAO_MANUAL,DOC0001
BA,UNEB,Educação a Distância,REMANSO - UAB,Remanso,Licenciatura em Matematica,http://dedc10.uneb.br/wp-content/uploads/2021/05/fluxograma_mat.pdf,http://dedc10.uneb.br/wp-content/uploads/2021/05/fluxograma_mat.pdf,http://dedc10.uneb.br/wp-content/uploads/2021/05/fluxograma_mat.pdf,OK_PDF,BF02378178787B4C451812FCFD6EED6B3BF44E16FAC79BE35C832865AE01DC8B,NAO,,5,POLO_ESPECIFICO,NAO_ENCONTRADO,POLO__POLO_ITABERABA_BA_CENTRO__Itaberaba,BA__UNEB__PRESENCIAL__POLO__Campus_X_Teixeira_de_Freitas__Teixeira_de_Freitas__NAO_ENCONTRADO__DOC0020.pdf,C:\Users\augus\Music\TCC\Data\new_date\pdfs_baixados\BA\BA__UNEB__PRESENCIAL__POLO__Campus_X_Teixeira_de_Freitas__Teixeira_de_Freitas__NAO_ENCONTRADO__DOC0020.pdf,"A página e o domínio do DEDC 10 / UNEB disponibilizam um arquivo PDF correspondente à 'INTEGRALIZAÇÃO CURRICULAR ... DEPARTAMENTO DE EDUCAÇÃO CAMPUS X – TEIXEIRA DE FREITAS LICENCIATURA EM MATEMÁTICA', contendo o fluxograma das disciplinas [web:152].",Consegui localizar publicamente de forma oficial apenas a matriz curricular (fluxograma) do curso de Licenciatura em Matemática ofertado no Campus X. O arquivo PDF oficial do PPC completo com projeto e ementas não foi acessado [web:152].,OK,DOC0020
BA,UNEB,Educação a Distância,Campus XXII - Euclides da Cunha,Euclides da Cunha,Licenciatura em Matematica,https://sead.ufba.br/cursos/licenciatura-em-matematica-5a-oferta,NAO_ENCONTRADO,,NAO_ENCONTRADO,,NAO,,4,INSTITUCIONAL_COMPARTILHADO,NAO_ENCONTRADO,,,,"O Campus XXII da UNEB informa, em site institucional, que possui cursos presenciais de Letras e Engenharia Agronômica e que já ofertou, a distância, cursos concluídos como Matemática; entretanto, nem o site do campus nem o da UNEAD disponibilizam PPC em PDF para a Licenciatura em Matemática EaD.[web:267][web:269][web:99]","A página do Campus XXII (DCHT – Euclides da Cunha) apresenta os cursos presenciais do campus (Licenciatura em Letras e Engenharia Agronômica), sem mencionar Licenciatura em Matemática presencial.[web:267][web:268] Um site informativo ligado ao campus registra que 'três de graduação (Matemática, Química, Educação Física)' foram ofertados a distância e já estão concluídos, indicando que houve uma oferta EaD de Matemática no Campus XXII.[web:269] A Licenciatura em Matemática EaD da UNEB, no entanto, é descrita apenas de forma geral no site da UNEAD, sem PPC em PDF acessível.[web:99][web:108] Não foi encontrado, em domínio uneb.br, Projeto Pedagógico do Curso específico para a oferta EaD de Matemática vinculada ao Campus XXII – Euclides da Cunha.",NOVA_BUSCA,
BA,UNEB,Educação Presencial,Campus XX-Parfor,Boquira,Licenciatura em Matematica,https://colmat.ufba.br,https://colmat.ufba.br/sites/colmat.ufba.br/files/ppc_matematica_noturno_2009_0.pdf,https://colmat.ufba.br/sites/colmat.ufba.br/files/ppc_matematica_noturno_2009_0.pdf,OK_PDF,F1A3D1FA1B9AC4B4EC36EC1E3E915010DFC31958B284907795FE369BAAF28EA4,SIM,,2,POLO_ESPECIFICO,2009,POLOS_3__Salvador_Ibotirama_Alagoinhas,BA__UFBA__PRESENCIAL__POLOS_2__Salvador__2009__DOC0010.pdf,C:\Users\augus\Music\TCC\Data\new_date\pdfs_baixados\BA\BA__UFBA__PRESENCIAL__POLOS_2__Salvador__2009__DOC0010.pdf,"O Colegiado de Matemática da UFBA disponibiliza o arquivo 'ppc_matematica_noturno_2009_0.pdf' identificado como Projeto Pedagógico do Curso Noturno de Licenciatura em Matemática, referente ao campus de Salvador (Ondina).","PPC específico para o curso noturno presencial de Licenciatura em Matemática, com cabeçalho da UFBA e identificação do colegiado; não há indicação de compartilhamento com outros campi.",OK,DOC0010
BA,UFBA,Educação a Distância,POLO JUAZEIRO-BA SÃO GERALDO,Juazeiro,Licenciatura em Matematica,https://unead.uneb.br/wp-content/uploads/2026/03/Enderecos-dos-polos.pdf,NAO_ENCONTRADO,,NAO_ENCONTRADO,,NAO,,1,POLO_ESPECIFICO,NAO_ENCONTRADO,,,,"A UFBA oferta a Licenciatura em Matemática EaD via SEAD com matriz curricular publicada em páginas institucionais e PPC avaliado pelo INEP, mas não disponibiliza o Projeto Pedagógico em PDF associado ao polo Juazeiro-BA São Geraldo.[web:185][web:177][web:183]","O arquivo 'Endereços dos polos' da UNEAD indica, para Xique-Xique, a entrada 'XIQUE-XIQUE – DEPARTAMENTO/ASSOCIADO: UAB E OFERTA PRÓPRIA – Rua João Guimarães, n° 1032, Bairro: São Francisco – Xique-Xique-BA – Matemática - 2024.2/2026.2', evidenciando que há curso de Matemática EaD vinculado ao Campus XXIV.[web:109] O site do DCHT – Campus Xique-Xique confirma que o campus funciona naquele endereço e informa que atualmente oferta bacharelados em Engenharia de Pesca e Engenharia Sanitária e Ambiental, sem detalhar cursos EaD de Matemática.[web:298] A página da Licenciatura em Matemática EaD na UNEAD descreve o curso apenas em nível institucional, sem PPC em PDF e sem vinculação clara ao Campus XXIV.[web:99] Como nenhum dos documentos oficiais localizados disponibiliza o Projeto Pedagógico do Curso de Matemática EaD para Xique-Xique, o PPC é considerado não encontrado.",NOVA_BUSCA,
BA,UNEB,Educação a Distância,VALENÇA - UAB,Valença,Licenciatura em Matematica,https://unead.uneb.br/index.php/matematica/,https://unead.uneb.br/wp-content/uploads/2021/06/MATRIZ-MATEMATICA-2010-1.pdf,https://unead.uneb.br/wp-content/uploads/2021/06/MATRIZ-MATEMATICA-2010-1.pdf,OK_PDF,26406F78AFA95437A257FF8F1AE1AAC875208FD3279FBA9F0C11746B5B30759D,SIM,,21,INSTITUCIONAL_COMPARTILHADO,2010,POLOS_6__Ibotirama_Conceicao_do_Coite_Irece_Carinhanha_Cristopolis_Simoes_Filho,BA__Universidade_do_Estado_da_Bahia_UNEB__EAD__POLOS_7__Ibotirama_Salvador_Brumado_Euclides_da_Cunha_Conceicao_do_Coite_Xique_Xique__2010__DOC0017.pdf,C:\Users\augus\Music\TCC\Data\new_date\pdfs_baixados\BA\BA__Universidade_do_Estado_da_Bahia_UNEB__EAD__POLOS_7__Ibotirama_Salvador_Brumado_Euclides_da_Cunha_Conceicao_do_Coite_Xique_Xique__2010__DOC0017.pdf,"Atualmente, os braços institucionais do curso LMatEaD na UFRB têm vínculo com os seguintes municípios/polos: Capim Grosso, Ipirá, Itabuna, Macaúbas, Rio Real, Sapeaçu, Teodoro Sampaio, Vitória da Conquista. [page:1]",Conversão bem-sucedida de HTML_INTERMEDIARIO para OK_PDF. A matriz curricular oficial (componente analítico indissociável do PPC) foi localizada intacta no domínio principal da UNEAD. O projeto pedagógico obedece estritamente à política de currículo unificado compartilhado para toda a rede UAB sob chancela da UNEB.,OK,DOC0017
BA,IFBA,Educação a Distância,Polo UAB de Seabra,Seabra,Licenciatura em Matematica,https://sead.ufba.br/cursos/licenciatura-em-matematica-3a-oferta,,,NAO_ENCONTRADO,,SIM,,5,INSTITUCIONAL_COMPARTILHADO,NAO_ENCONTRADO,POLOS_7__Sao_Francisco_do_Conde_Paulo_Afonso_Irece_Lauro_de_Freitas_Seabra_Salvador_Euclides_da_Cunh,,,"A Licenciatura em Matemática EaD do IFBA utiliza um único Projeto Pedagógico de Curso, formalizado no documento PPC_Lic._Matematica_EaD_1.pdf, para todos os polos UAB; notícias oficiais apontam Seabra como um dos polos de apoio presencial do curso de Matemática EaD.[web:15][web:16][web:9][web:142] | EXCLUIDO_MANUAL_NAO_PPC_BA_DOC0001","Reportagem de 2023 sobre a oferta de 200 vagas em licenciaturas EaD de Física e Matemática pelo IFBA informa que, para a licenciatura em Matemática, os polos de apoio presencial estão localizados em Dias D’Ávila, Euclides da Cunha, Paulo Afonso, Salvador e Seabra.[web:9][web:129] Notícias e editais anteriores já indicavam Seabra entre os polos das licenciaturas EaD do IFBA no âmbito do UAB.[web:142][web:146] A página institucional do curso de Licenciatura em Matemática EaD e o arquivo PPC_Lic._Matematica_EaD_1.pdf confirmam que há um único PPC aprovado pelo CONSEPE para o curso EaD de Matemática do campus Salvador, que é utilizado para todos os polos.[web:15][web:16] Dessa forma, o mesmo PPC é compartilhado entre Seabra e os demais polos listados. | Excluido manualmente: BA DOC0001 nao e PPC valido.",VALIDACAO_MANUAL,DOC0001
BA,UNEB,Educação a Distância,Campus XXIV - Xique-Xique,Xique-Xique,Licenciatura em Matemática,https://portal.ifba.edu.br/ead/uab/cursos/licenciaturas/matematica/lic-matematica,,,NAO_ENCONTRADO,,SIM,,2,INSTITUCIONAL_COMPARTILHADO,,POLOS_7__Sao_Francisco_do_Conde_Paulo_Afonso_Irece_Lauro_de_Freitas_Seabra_Salvador_Euclides_da_Cunh,,,"Resolução do IFBA registra: 'Aprovar Ad Referendum do CONSEPE o Projeto Pedagógico do Curso Superior de Licenciatura em Matemática na modalidade Educação a Distância do campus Salvador', vinculada ao arquivo PPC_Lic._Matematica_EaD_1.pdf.[web:16] | EXCLUIDO_MANUAL_NAO_PPC_BA_DOC0001","O arquivo 'Endereços dos polos' da UNEAD indica, para Xique-Xique, a entrada 'XIQUE-XIQUE – DEPARTAMENTO/ASSOCIADO: UAB E OFERTA PRÓPRIA – Rua João Guimarães, n° 1032, Bairro: São Francisco – Xique-Xique-BA – Matemática - 2024.2/2026.2', evidenciando que há curso de Matemática EaD vinculado ao Campus XXIV.[web:109] O site do DCHT – Campus Xique-Xique confirma que o campus funciona naquele endereço e informa que atualmente oferta bacharelados em Engenharia de Pesca e Engenharia Sanitária e Ambiental, sem detalhar cursos EaD de Matemática.[web:298] A página da Licenciatura em Matemática EaD na UNEAD descreve o curso apenas em nível institucional, sem PPC em PDF e sem vinculação clara ao Campus XXIV.[web:99] Como nenhum dos documentos oficiais localizados disponibiliza o Projeto Pedagógico do Curso de Matemática EaD para Xique-Xique, o PPC é considerado não encontrado. | Excluido manualmente: BA DOC0001 nao e PPC valido.",VALIDACAO_MANUAL,DOC0001
BA,UNEB,Educação a Distância,SÍTIO DO QUINTO - UAB,Sítio do Quinto,Licenciatura em Matematica,https://www2.ufrb.edu.br/ead/cursos-de-graduacao-ead/19-paginas-do-site/485-licenciatura-em-matematica,https://ufrb.edu.br/cetec/images/documentos/Diversos/PPC_LMatEaD.pdf,https://ufrb.edu.br/cetec/images/documentos/Diversos/PPC_LMatEaD.pdf,OK_PDF,40F4848128BE5761076E3842132F510C17066B93408DEE582A011E7A86FC7A81,SIM,,12,POLO_ESPECIFICO,2011,POLOS_9__Cruz_das_Almas_Teixeira_de_Freitas_Capim_Grosso_Vitoria_da_Conquista_Rio_Real_Ilheus_Ipira_,BA__UFRB__EAD__POLOS_3__Macaubas_Vitoria_da_Conquista_Ipira__2019__DOC0007.pdf,C:\Users\augus\Music\TCC\Data\new_date\pdfs_baixados\BA\BA__UFRB__EAD__POLOS_3__Macaubas_Vitoria_da_Conquista_Ipira__2019__DOC0007.pdf,"O PPC_LMatEaD é o Projeto Pedagógico institucional do curso de Licenciatura em Matemática EaD da UFRB; a página oficial do curso mostra que um único curso EaD atende múltiplos polos UAB, com um PPC único compartilhado entre eles.[web:94][web:95][web:96]","A UFRB relata, em notícias e na página do curso EaD, a oferta de Licenciatura em Matemática na modalidade a distância com distribuição de vagas em polos de apoio presenciais na Bahia.[web:95][web:241][web:245] O PPC_LMatEaD, aprovado por resolução interna e publicado em ufrb.edu.br, estabelece toda a estrutura pedagógica e curricular do curso LMatEaD e é utilizado como referência única para as ofertas em todos os polos UAB ligados ao curso.[web:94][web:96] Embora a lista de polos exibida na página do curso destaque Alagoinhas, Amargosa, Capim Grosso, Feira de Santana, Irecê, Itaberaba, Macaúbas, Remanso, Rio Real, Sapeaçu, Simões Filho e Teixeira de Freitas,[web:95] o mesmo PPC se aplica às demais unidades de oferta do curso LMatEaD, incluindo o Polo UAB: IPIRA - SETE DE JULHO, segundo o cadastro fornecido neste levantamento.",OK,DOC0007
BA,UFBA,Educação a Distância,POLO UAB Mata de Sao Joao,Mata de São João,Licenciatura em Matematica,https://unead.uneb.br/index.php/matematica/,NAO_ENCONTRADO,,NAO_ENCONTRADO,,NAO,,1,POLO_ESPECIFICO,NAO_ENCONTRADO,,,,"A documentação da SEAD/UFBA demonstra a existência e oferta da Licenciatura em Matemática EaD em polos baianos, com PPC citado em relatório do INEP, mas o Projeto Pedagógico não é disponibilizado publicamente em PDF para o curso ou para o polo Mata de São João.[web:185][web:177][web:183]","A SEAD/UFBA divulga as diferentes ofertas da Licenciatura em Matemática EaD com detalhamento de disciplinas, carga horária e princípios pedagógicos, mas essas páginas não são denominadas nem publicadas como Projeto Pedagógico do Curso.[web:182][web:185][web:188][web:191] O edital de chamamento público às prefeituras para formação de polos cita a Licenciatura em Matemática EaD como um dos cursos de graduação a distância, sem anexar PPC.[web:183] O relatório INEP confirma que o curso possui PPC estruturado, sem fornecer o arquivo.[web:177] Não foi localizado, em ufba.br, PPC de Matemática EaD público vinculado ao polo UAB Mata de São João.",NOVA_BUSCA,
BA,UNEB,Educação a Distância,UNEAD,Carinhanha,Licenciatura em Matemática,https://unead.uneb.br/index.php/matematica/,https://unead.uneb.br/wp-content/uploads/2021/06/MATRIZ-MATEMATICA-2010-1.pdf,https://unead.uneb.br/wp-content/uploads/2021/06/MATRIZ-MATEMATICA-2010-1.pdf,OK_PDF,26406F78AFA95437A257FF8F1AE1AAC875208FD3279FBA9F0C11746B5B30759D,NAO,,21,POLO_ESPECIFICO,2010,POLOS_6__Ibotirama_Conceicao_do_Coite_Irece_Carinhanha_Cristopolis_Simoes_Filho,BA__Universidade_do_Estado_da_Bahia_UNEB__EAD__POLOS_7__Ibotirama_Salvador_Brumado_Euclides_da_Cunha_Conceicao_do_Coite_Xique_Xique__2010__DOC0017.pdf,C:\Users\augus\Music\TCC\Data\new_date\pdfs_baixados\BA\BA__Universidade_do_Estado_da_Bahia_UNEB__EAD__POLOS_7__Ibotirama_Salvador_Brumado_Euclides_da_Cunha_Conceicao_do_Coite_Xique_Xique__2010__DOC0017.pdf,"Curso: MATEMÁTICA... Nível: Graduação - EAD... O documento do PPC é rigorosamente compartilhado e aplicado de forma isomórfica entre todos os polos de oferta integrados via sistema UAB, abrangendo o polo instalado no município de Euclides da Cunha.","Resoluções oficiais (como a Resolução Consepe 11 da UESB) e referências bibliográficas confirmam a existência do PPC de Matemática no campus de Jequié, mas o arquivo PDF do projeto não foi encontrado na íntegra. [web:50][web:51]",NOVA_BUSCA,DOC0017
BA,UNEB,Educação Presencial,Guanambi,Guanambi,Licenciatura em Matemática,https://www.uesc.br/matematica/licenciatura/,NAO_ENCONTRADO,,NAO_ENCONTRADO,,NAO,,1,INSTITUCIONAL_COMPARTILHADO,,,,,"O estudo da SBEM sobre Licenciaturas em Matemática da UNEB lista apenas os campi II, VI, VII, VIII, IX e X como ofertantes do curso, não incluindo unidade em Guanambi; tampouco foi localizado PPC de Licenciatura em Matemática da UNEB em Guanambi em domínio oficial.[web:252]","Em análise dos documentos da UNEB e do artigo da SBEM sobre os cursos de Licenciatura em Matemática da universidade, não há referência a um curso de Licenciatura em Matemática em Guanambi.[web:252] Os PPCs localizados referem-se a outros campi (por exemplo, DEDC VIII/Paulo Afonso, DCH VI/Caetité, DCH II/Alagoinhas), e nenhum é vinculado a um campus ou departamento em Guanambi.[web:91][web:262] Diante da ausência de evidência oficial de curso e de qualquer Projeto Pedagógico publicado para Licenciatura em Matemática em Guanambi, o PPC é considerado não encontrado.",VALIDACAO_MANUAL,
BA,UESC,Educação a Distância,Polo UAB - Itamaraju,Itamaraju,Licenciatura em Matematica,https://nead.uesc.br/cursos/matematica/,NAO_ENCONTRADO,,NAO_ENCONTRADO,,NAO,,1,POLO_ESPECIFICO,NAO_ENCONTRADO,,,,"Notícia sobre novos cursos da UNEB indica que foi autorizado um curso de Licenciatura em Matemática para moradores de Jeremoabo, realizado fora de sede em outro departamento, mas não há qualquer Projeto Pedagógico do Curso disponível em domínio oficial.[web:280]","Reportagem regional relata que a UNEB teve novos cursos autorizados em Serrinha, Jeremoabo e Teixeira de Freitas, mencionando 'curso de Licenciatura em Matemática para moradores da cidade' a ser realizado fora de sede, no departamento de outra unidade.[web:280] Entretanto, não foi localizado em sites oficiais da UNEB (campus local, departamento associado, PROGRAD ou conselhos) nenhum arquivo identificado como PPC da Licenciatura em Matemática de Jeremoabo, nem resolução anexando PPC para essa oferta. Assim, não é possível informar ano_ppc nem URL de PPC em PDF.",NOVA_BUSCA,
BA,UESC,Educação a Distância,Polo UAB - Teixeira de Freitas,Teixeira de Freitas,Licenciatura em Matematica,https://portal.ifba.edu.br/ead/uab/cursos/licenciaturas/matematica/lic-matematica,https://portal.ifba.edu.br/ead/uab/cursos/licenciaturas/matematica/documentos/ppc-2023-licmatead_merged-final.pdf,https://portal.ifba.edu.br/ead/uab/cursos/licenciaturas/matematica/documentos/ppc-2023-licmatead_merged-final.pdf,OK_PDF,EE12BA1E3E451CFB965340844A3894927AC0FC0EA750021A3B1E7C5CB33A7690,SIM,,5,INSTITUCIONAL_COMPARTILHADO,2023,POLOS_4__Itabuna_Brumado_Eunapolis_Dias_d_Avila,BA__Instituto_Federal_de_Educacao_Ciencia_e_Tecnologia_da_Bahia_IFBA__EAD__POLOS_6__Paulo_Afonso_Dias_d_Avila_Euclides_da_Cunha_Irece_Seabra_Salvador__2023__DOC0006.pdf,C:\Users\augus\Music\TCC\Data\new_date\pdfs_baixados\BA\BA__Instituto_Federal_de_Educacao_Ciencia_e_Tecnologia_da_Bahia_IFBA__EAD__POLOS_6__Paulo_Afonso_Dias_d_Avila_Euclides_da_Cunha_Irece_Seabra_Salvador__2023__DOC0006.pdf,"A ficha técnica e a seção 'Documentos do Curso' da página oficial da Licenciatura em Matemática EaD do IFBA indicam um único PPC (PDF) associado ao curso, sem distinções por polo, o que evidencia que o documento é compartilhado entre todos os polos do programa UAB.","Editais e relatórios de gestão citam turmas de Licenciatura em Matemática EaD em diversos polos UAB, mas nenhum deles disponibiliza o PPC como arquivo público; sem URL e evidência literal, o PPC permanece não recuperável para Itaberaba.",OK,DOC0006
BA,UNEB,Educação Presencial,Campus X - Teixeira de Freitas,Teixeira de Freitas,Licenciatura em Matematica,https://ufrb.edu.br/cetec/images/documentos/Diversos/PPC_LMatEaD.pdf,https://ufrb.edu.br/cetec/images/documentos/Diversos/PPC_LMatEaD.pdf,https://ufrb.edu.br/cetec/images/documentos/Diversos/PPC_LMatEaD.pdf,OK_PDF,40F4848128BE5761076E3842132F510C17066B93408DEE582A011E7A86FC7A81,SIM,,8,INSTITUCIONAL_COMPARTILHADO,2019,POLOS_9__Cruz_das_Almas_Teixeira_de_Freitas_Capim_Grosso_Vitoria_da_Conquista_Rio_Real_Ilheus_Ipira_,BA__UFRB__EAD__POLOS_3__Macaubas_Vitoria_da_Conquista_Ipira__2019__DOC0007.pdf,C:\Users\augus\Music\TCC\Data\new_date\pdfs_baixados\BA\BA__UFRB__EAD__POLOS_3__Macaubas_Vitoria_da_Conquista_Ipira__2019__DOC0007.pdf,"Atualmente, os braços institucionais do curso LMatEaD na UFRB têm vínculo com os seguintes municípios/polos: Capim Grosso, Ipirá, Itabuna, Macaúbas, Rio Real, Sapeaçu, Teodoro Sampaio, Vitória da Conquista. [page:1]","O Projeto Pedagógico foi encontrado no portal do CETEC/UFRB. Ele é compartilhado e atende expressamente a lista de municípios que abrigam os polos EaD, incluindo Vitória da Conquista.",OK,DOC0007
